,Unnamed: 0,content,email,product_id,status,name,photo_urls,created_at,rating,product_title,product_sku,product_url,product_handle,country_code
5,13,Where is my review??,Randa.z@hotmail.com,8205978239198,published,Randa,,2024-11-03T21:19:25.693Z,5,The Revo Cup,,https://skinitii.com/products/the-cup,the-revo-cup,LB
6,14,To test reviews,Fahed@hotmail.com,8205978239198,published,Hanane,,2024-11-03T21:17:38.507Z,5,The Revo Cup,,https://skinitii.com/products/the-cup,the-revo-cup,LB
16,24,Amazing,Reine_27@hotmail.com,8205978239198,published,Reine,,2024-01-23T09:27:26.624Z,4,The Revo Cup,,https://0a8e61-3.myshopify.com/products/the-cup,the-revo-cup,LB
17,25,"The pressure is way more than you think, as someone not used to this i was very scared at first. Took me a while to understand how to use it and to get used to it, but now i find it very good.",,8205978239198,published,Sana,https://firebasestorage.googleapis.com/v0/b/air-reviews.appspot.com/o/submitReview%2FReBzPOMbwJOuBPUUG09U%2F1703583745396_IMG_9500.webp?alt=media&token=786b034f-43d4-403c-a125-2f56b9168814,2023-12-19T00:00:00.000Z,4,The Revo Cup,,https://0a8e61-3.myshopify.com/products/the-cup,the-revo-cup,FR
18,26,"Ordered 2, works exactly like normal cupping therapy, even better.",,8205978239198,published,Ali,https://firebasestorage.googleapis.com/v0/b/air-reviews.appspot.com/o/submitReview%2FReBzPOMbwJOuBPUUG09U%2F1703583783515_IMG_9499.webp?alt=media&token=c9467e22-54e7-48b1-90c2-8c307c9750fa,2023-12-15T00:00:00.000Z,5,The Revo Cup,,https://0a8e61-3.myshopify.com/products/the-cup,the-revo-cup,FR
19,27,"I have to say i am pretty impressed with how much customer service helped me as well. I am using it for pain relief and muscle tension, and i am liking it. I always did cupping therapy and i highly recommend this product for however is used to it as well.",,8205978239198,published,Fady ,"https://firebasestorage.googleapis.com/v0/b/air-reviews.appspot.com/o/submitReview%2FReBzPOMbwJOuBPUUG09U%2F1701258049438_IMG_8692.webp?alt=media&token=c042bfc4-e46c-4c2c-ba43-0208cb6ab504, https://firebasestorage.googleapis.com/v0/b/air-reviews.appspot.com/o/submitReview%2FReBzPOMbwJOuBPUUG09U%2F1701258049439_IMG_8693.webp?alt=media&token=505ac1b8-0a33-41ea-a6d1-660418eb5f3a",2023-11-30T00:00:00.000Z,5,The Revo Cup,,https://0a8e61-3.myshopify.com/products/the-cup,the-revo-cup,IT
20,28,I love it. Amazing for back pain and muscle recovery! I lift weights and this is essential for me.,,8205978239198,published,David,https://firebasestorage.googleapis.com/v0/b/air-reviews.appspot.com/o/submitReview%2FReBzPOMbwJOuBPUUG09U%2F1701258398388_IMG_8691.webp?alt=media&token=013b797a-9a0d-48d6-b92a-65c10c370f41,2023-11-29T11:47:10.402Z,5,The Revo Cup,,https://0a8e61-3.myshopify.com/products/the-cup,the-revo-cup,IT
21,29,"Everything good, nice packaging. I tried it for 2 minutes the suction is very strong i’m impressed.",,8205978239198,published,Sahar,https://firebasestorage.googleapis.com/v0/b/air-reviews.appspot.com/o/submitReview%2FReBzPOMbwJOuBPUUG09U%2F1701258221035_IMG_8690.webp?alt=media&token=7aaee4cd-386f-4860-a0e4-9ced16569016,2023-11-24T00:00:00.000Z,5,The Revo Cup,,https://0a8e61-3.myshopify.com/products/the-cup,the-revo-cup,IT
22,30,"Love this product, I bought it on a whim to help muscles and love it more than I thought. It has helped my knee and leg pain. ktir bonsahkon",,8205978239198,published,Charbel,https://firebasestorage.googleapis.com/v0/b/air-reviews.appspot.com/o/submitReview%2FReBzPOMbwJOuBPUUG09U%2F1700935037563_Screenshot%202023-11-25%20at%2018.56.24.webp?alt=media&token=efe830ee-0df4-4b22-b215-518f251f7396,2023-11-23T00:00:00.000Z,5,The Revo Cup,,https://0a8e61-3.myshopify.com/products/the-cup,the-revo-cup,IT
23,31,im asian(super love acupunture treatment) im so happy to find this in Lebanon. buy this and use it. good for ur body.,,8205978239198,published,Seychee,https://firebasestorage.googleapis.com/v0/b/air-reviews.appspot.com/o/submitReview%2FReBzPOMbwJOuBPUUG09U%2F1700934832965_61PCsjRxPqL._SL1600_.webp?alt=media&token=bdc0599b-0d7d-40c5-bd82-71b4ac9efb5e,2023-11-22T00:00:00.000Z,5,The Revo Cup,,https://0a8e61-3.myshopify.com/products/the-cup,the-revo-cup,IT
24,32,I love it! ive been using it for 2 weeks for cellulite reduction and it really has been amazing.,,8205978239198,published,Claritta,https://firebasestorage.googleapis.com/v0/b/air-reviews.appspot.com/o/submitReview%2FReBzPOMbwJOuBPUUG09U%2F1700934668756_717a9dMVGgL._SL1600_.webp?alt=media&token=25461641-fda4-44f8-834f-eae5f57a49bf,2023-11-17T00:00:00.000Z,5,The Revo Cup,,https://0a8e61-3.myshopify.com/products/the-cup,the-revo-cup,IT
